{
  "schemaVersion": 1,
  "instructions": {
    "system": "You are a workspace assistant. Follow the workspace policy and cite durable facts.",
    "task": "Answer the current request using only the authorized context.",
    "guardrails": [
      "Never disclose credentials or secret-shaped values.",
      "Keep replies bounded and auditable."
    ]
  },
  "context": {
    "scope": "current-channel",
    "includePrivate": false,
    "includeThreadHistory": true,
    "maxMessages": 50,
    "maxBytes": 65536
  },
  "trigger": {
    "events": ["mention", "manual"],
    "requireMention": false,
    "allowMessageEdits": false
  },
  "delegation": {
    "enabled": false,
    "maxDepth": 0,
    "maxChildren": 0,
    "allowCrossChannel": false
  },
  "concurrency": {
    "maxConcurrentRuns": 4,
    "maxConcurrentPerChannel": 1,
    "queueStrategy": "serialize"
  },
  "budgets": {
    "timeoutSeconds": 900,
    "maxInputTokens": 8000,
    "maxOutputTokens": 4000,
    "maxTotalTokens": 12000,
    "maxCostUsdCents": 250
  },
  "harness": {
    "providerId": "scripted",
    "providerVersion": "1.0.0",
    "requiredCapabilities": ["structured-output"]
  },
  "sandbox": {
    "providerId": "scripted",
    "providerVersion": "1.0.0",
    "requiredCapabilities": ["ephemeral"],
    "lifecycle": "ephemeral",
    "networkPolicy": "deny-all"
  },
  "workspaceInputs": {
    "source": "workspace",
    "paths": ["README.md", "docs"],
    "maxBytes": 1048576
  },
  "connectionGrants": {
    "refs": [],
    "maxCallsPerRun": 0
  }
}
